{
  "software_full_name": "脱敏工单协同管理系统",
  "software_short_name": "演示工单协同管理系统",
  "version": "V1.0",
  "rightsholder": {
    "type": "legal_person",
    "name": "演示软件研究中心",
    "id_type": "演示标识",
    "id_number": "DEMO-WEB-PROJECT-ONLY"
  },
  "completion_date": "2026-08-01",
  "development_mode": "independent",
  "software_nature": "original",
  "publication": {
    "status": "unpublished"
  },
  "rights_acquisition": "original",
  "rights_scope": {
    "type": "all",
    "detail": ""
  },
  "ownership_notes": "完全合成的开源演示事实，不用于真实申请。",
  "screenshot_mode": "user_supplied",
  "confirmed_by": "demo-builder",
  "confirmed_at": "2026-08-11T00:00:00+08:00"
}
